tweet,A,H,target,"Religion/creed","Race/ethnicity","Physical/disability","Gender/sexual","Other"
Эти урусы уже поперек горла. Нам старший скоро привезет груз и мы пойдем подымать на воздух метро,1,1,G,0,1,0,0,0
Эротически сцены - это в принципе нормальнео явленя для современного кино,0,0,0,0,0,0,0,0
"В некоторых передачах обсуждаются откровенно порнографические подробности, однако как правило время передач после полуночи",0,0,0,0,0,0,0,0
"Я бы тебя оттарбанил своей сосиской, у тебя бы все болело",1,0,G,0,0,0,0,0
Люблю страпонить красивых мальчиков и смотреть как они сопротивляются,1,0,G,0,0,0,0,0